{
  "source_sha": "9d9f542cb04669e60aa6dad0c81087e1377083c3",
  "contracts_version": "3.2.0",
  "contracts_checksum": "sha256:b905cfb87111ac50197a495ad487694eb379e192e3e92c07179bbb45ad2fda2a",
  "schema_version": 166,
  "route_map_checksum": "sha256:6c2d992f1c57f448e7b9223704cdbb49e07fa7014c40b4f7bc2e408810a01ac3",
  "services": {
    "gateway": {
      "repository": "allanVvz/brain-plataform",
      "sha": "7c8fa8ffdb0b9ec73e143978b58367cf0336488e",
      "digest": "sha256:77d045d4ef6af3b049b37959554f701b90a4c032ba90f53ec756383ba00c7610",
      "required_schema_version": 164,
      "contracts_version": "3.2.0",
      "contracts_checksum": "sha256:b905cfb87111ac50197a495ad487694eb379e192e3e92c07179bbb45ad2fda2a",
      "build_context": "apps/gateway"
    },
    "control-plane": {
      "repository": "allanVvz/brain-plataform",
      "sha": "e42e7c468f613a4489f9d946b61ba9ae0916f2cd",
      "digest": "sha256:259971fd9b4fb8f14dce870c195905c9776bf1016fe61a9bc85ff540ed404392",
      "required_schema_version": 163,
      "contracts_version": "3.2.0",
      "contracts_checksum": "sha256:b905cfb87111ac50197a495ad487694eb379e192e3e92c07179bbb45ad2fda2a",
      "build_context": "apps/control-plane"
    },
    "conversation-runtime": {
      "repository": "allanVvz/brain-plataform",
      "sha": "5ad1678bb7840706cb040163d14d62838ee9b6ad",
      "digest": "sha256:51bd8f6b566c14f1af4d378bc7e829b5d2c6b327a17bd8f347aea0fcb20ffa80",
      "required_schema_version": 161,
      "contracts_version": "3.2.0",
      "contracts_checksum": "sha256:b905cfb87111ac50197a495ad487694eb379e192e3e92c07179bbb45ad2fda2a",
      "build_context": "apps/conversation-runtime"
    },
    "transport": {
      "repository": "allanVvz/brain-plataform",
      "sha": "9d9f542cb04669e60aa6dad0c81087e1377083c3",
      "digest": "sha256:421cd186593854fa8353838f1ba791ed4c0aa6e0c0d37fd68948b2aee5cafb6c",
      "required_schema_version": 165,
      "contracts_version": "3.2.0",
      "contracts_checksum": "sha256:b905cfb87111ac50197a495ad487694eb379e192e3e92c07179bbb45ad2fda2a",
      "build_context": "apps/transport"
    }
  }
}
